"ID","Title","Overlapping genes","GO group size","n","E","P.Value","adj.P.Val","ontology"
"GO:0002441","histamine secretion involved in inflammatory response",1,8,350,4.6275,0.196784118089998,0.917082036118248,"BP"
"GO:0002488","antigen processing and presentation of endogenous peptide antigen via MHC class Ib via ER pathway",1,8,350,4.6275,0.196784118089998,0.917082036118248,"BP"
"GO:0002489","antigen processing and presentation of endogenous peptide antigen via MHC class Ib via ER pathway, TAP-dependent",1,8,350,4.6275,0.196784118089998,0.917082036118248,"BP"
"GO:0002553","histamine secretion by mast cell",1,8,350,4.6275,0.196784118089998,0.917082036118248,"BP"
"GO:0002679","respiratory burst involved in defense response",1,8,350,4.6275,0.196784118089998,0.917082036118248,"BP"
"GO:0003139","secondary heart field specification",1,8,350,4.6275,0.196784118089998,0.917082036118248,"BP"
"GO:0007135","meiosis II",1,8,350,4.6275,0.196784118089998,0.917082036118248,"BP"
"GO:0008354","germ cell migration",1,8,350,4.6275,0.196784118089998,0.917082036118248,"BP"
"GO:0009120","deoxyribonucleoside metabolic process",1,8,350,4.6275,0.196784118089998,0.917082036118248,"BP"
"GO:0009313","oligosaccharide catabolic process",1,8,350,4.6275,0.196784118089998,0.917082036118248,"BP"
"GO:0021546","rhombomere development",1,8,350,4.6275,0.196784118089998,0.917082036118248,"BP"
"GO:0023035","CD40 signaling pathway",1,8,350,4.6275,0.196784118089998,0.917082036118248,"BP"
"GO:0032353","negative regulation of hormone biosynthetic process",1,8,350,4.6275,0.196784118089998,0.917082036118248,"BP"
"GO:0032782","bile acid secretion",1,8,350,4.6275,0.196784118089998,0.917082036118248,"BP"
"GO:0033234","negative regulation of protein sumoylation",1,8,350,4.6275,0.196784118089998,0.917082036118248,"BP"
"GO:0034351","negative regulation of glial cell apoptotic process",1,8,350,4.6275,0.196784118089998,0.917082036118248,"BP"
"GO:0034650","cortisol metabolic process",1,8,350,4.6275,0.196784118089998,0.917082036118248,"BP"
"GO:0035278","miRNA mediated inhibition of translation",1,8,350,4.6275,0.196784118089998,0.917082036118248,"BP"
"GO:0035999","tetrahydrofolate interconversion",1,8,350,4.6275,0.196784118089998,0.917082036118248,"BP"
"GO:0036297","interstrand cross-link repair",1,8,350,4.6275,0.196784118089998,0.917082036118248,"BP"
"GO:0038093","Fc receptor signaling pathway",1,8,350,4.6275,0.196784118089998,0.917082036118248,"BP"
"GO:0040033","negative regulation of translation, ncRNA-mediated",1,8,350,4.6275,0.196784118089998,0.917082036118248,"BP"
"GO:0042118","endothelial cell activation",1,8,350,4.6275,0.196784118089998,0.917082036118248,"BP"
"GO:0042447","hormone catabolic process",1,8,350,4.6275,0.196784118089998,0.917082036118248,"BP"
"GO:0042977","activation of JAK2 kinase activity",1,8,350,4.6275,0.196784118089998,0.917082036118248,"BP"
"GO:0042989","sequestering of actin monomers",1,8,350,4.6275,0.196784118089998,0.917082036118248,"BP"
"GO:0045217","cell-cell junction maintenance",1,8,350,4.6275,0.196784118089998,0.917082036118248,"BP"
"GO:0045974","regulation of translation, ncRNA-mediated",1,8,350,4.6275,0.196784118089998,0.917082036118248,"BP"
"GO:0046060","dATP metabolic process",1,8,350,4.6275,0.196784118089998,0.917082036118248,"BP"
"GO:0048631","regulation of skeletal muscle tissue growth",1,8,350,4.6275,0.196784118089998,0.917082036118248,"BP"
"GO:0051132","NK T cell activation",1,8,350,4.6275,0.196784118089998,0.917082036118248,"BP"
"GO:0051459","regulation of corticotropin secretion",1,8,350,4.6275,0.196784118089998,0.917082036118248,"BP"
"GO:0060027","convergent extension involved in gastrulation",1,8,350,4.6275,0.196784118089998,0.917082036118248,"BP"
"GO:0060087","relaxation of vascular smooth muscle",1,8,350,4.6275,0.196784118089998,0.917082036118248,"BP"
"GO:0060177","regulation of angiotensin metabolic process",1,8,350,4.6275,0.196784118089998,0.917082036118248,"BP"
"GO:0060534","trachea cartilage development",1,8,350,4.6275,0.196784118089998,0.917082036118248,"BP"
"GO:0060837","blood vessel endothelial cell differentiation",1,8,350,4.6275,0.196784118089998,0.917082036118248,"BP"
"GO:0061009","common bile duct development",1,8,350,4.6275,0.196784118089998,0.917082036118248,"BP"
"GO:0061101","neuroendocrine cell differentiation",1,8,350,4.6275,0.196784118089998,0.917082036118248,"BP"
"GO:0070922","small RNA loading onto RISC",1,8,350,4.6275,0.196784118089998,0.917082036118248,"BP"
"GO:0071294","cellular response to zinc ion",1,8,350,4.6275,0.196784118089998,0.917082036118248,"BP"
"GO:0071397","cellular response to cholesterol",1,8,350,4.6275,0.196784118089998,0.917082036118248,"BP"
"GO:0071732","cellular response to nitric oxide",1,8,350,4.6275,0.196784118089998,0.917082036118248,"BP"
"GO:0072124","regulation of glomerular mesangial cell proliferation",1,8,350,4.6275,0.196784118089998,0.917082036118248,"BP"
"GO:0090050","positive regulation of cell migration involved in sprouting angiogenesis",1,8,350,4.6275,0.196784118089998,0.917082036118248,"BP"
"GO:0090209","negative regulation of triglyceride metabolic process",1,8,350,4.6275,0.196784118089998,0.917082036118248,"BP"
"GO:0090244","Wnt signaling pathway involved in somitogenesis",1,8,350,4.6275,0.196784118089998,0.917082036118248,"BP"
"GO:1900165","negative regulation of interleukin-6 secretion",1,8,350,4.6275,0.196784118089998,0.917082036118248,"BP"
"GO:1901299","negative regulation of hydrogen peroxide-mediated programmed cell death",1,8,350,4.6275,0.196784118089998,0.917082036118248,"BP"
"GO:1901339","regulation of store-operated calcium channel activity",1,8,350,4.6275,0.196784118089998,0.917082036118248,"BP"
"GO:1904659","glucose transmembrane transport",1,8,350,4.6275,0.196784118089998,0.917082036118248,"BP"
"GO:2000270","negative regulation of fibroblast apoptotic process",1,8,350,4.6275,0.196784118089998,0.917082036118248,"BP"
"GO:2000643","positive regulation of early endosome to late endosome transport",1,8,350,4.6275,0.196784118089998,0.917082036118248,"BP"
"GO:2000848","positive regulation of corticosteroid hormone secretion",1,8,350,4.6275,0.196784118089998,0.917082036118248,"BP"
"GO:2001135","regulation of endocytic recycling",1,8,350,4.6275,0.196784118089998,0.917082036118248,"BP"
"GO:2001185","regulation of CD8-positive, alpha-beta T cell activation",1,8,350,4.6275,0.196784118089998,0.917082036118248,"BP"
"GO:2001204","regulation of osteoclast development",1,8,350,4.6275,0.196784118089998,0.917082036118248,"BP"
"GO:0003857","3-hydroxyacyl-CoA dehydrogenase activity",1,8,350,4.6275,0.196784118089998,0.917082036118248,"MF"
"GO:0003993","acid phosphatase activity",1,8,350,4.6275,0.196784118089998,0.917082036118248,"MF"
"GO:0004119","cGMP-inhibited cyclic-nucleotide phosphodiesterase activity",1,8,350,4.6275,0.196784118089998,0.917082036118248,"MF"
"GO:0004499","N,N-dimethylaniline monooxygenase activity",1,8,350,4.6275,0.196784118089998,0.917082036118248,"MF"
"GO:0004779","sulfate adenylyltransferase activity",1,8,350,4.6275,0.196784118089998,0.917082036118248,"MF"
"GO:0005024","transforming growth factor beta-activated receptor activity",1,8,350,4.6275,0.196784118089998,0.917082036118248,"MF"
"GO:0008192","RNA guanylyltransferase activity",1,8,350,4.6275,0.196784118089998,0.917082036118248,"MF"
"GO:0008430","selenium binding",1,8,350,4.6275,0.196784118089998,0.917082036118248,"MF"
"GO:0008889","glycerophosphodiester phosphodiesterase activity",1,8,350,4.6275,0.196784118089998,0.917082036118248,"MF"
"GO:0015385","sodium:proton antiporter activity",1,8,350,4.6275,0.196784118089998,0.917082036118248,"MF"
"GO:0016723","oxidoreductase activity, oxidizing metal ions, NAD or NADP as acceptor",1,8,350,4.6275,0.196784118089998,0.917082036118248,"MF"
"GO:0016861","intramolecular oxidoreductase activity, interconverting aldoses and ketoses",1,8,350,4.6275,0.196784118089998,0.917082036118248,"MF"
"GO:0016889","endodeoxyribonuclease activity, producing 3'-phosphomonoesters",1,8,350,4.6275,0.196784118089998,0.917082036118248,"MF"
"GO:0033677","DNA/RNA helicase activity",1,8,350,4.6275,0.196784118089998,0.917082036118248,"MF"
"GO:0035014","phosphatidylinositol 3-kinase regulator activity",1,8,350,4.6275,0.196784118089998,0.917082036118248,"MF"
"GO:0035612","AP-2 adaptor complex binding",1,8,350,4.6275,0.196784118089998,0.917082036118248,"MF"
"GO:0050542","icosanoid binding",1,8,350,4.6275,0.196784118089998,0.917082036118248,"MF"
"GO:0050543","icosatetraenoic acid binding",1,8,350,4.6275,0.196784118089998,0.917082036118248,"MF"
"GO:0071933","Arp2/3 complex binding",1,8,350,4.6275,0.196784118089998,0.917082036118248,"MF"
"GO:1901567","fatty acid derivative binding",1,8,350,4.6275,0.196784118089998,0.917082036118248,"MF"
"GO:1990459","transferrin receptor binding",1,8,350,4.6275,0.196784118089998,0.917082036118248,"MF"
"GO:0046620","regulation of organ growth",4,85,350,1.74211764705882,0.197372704123051,0.919312327565336,"BP"
"GO:0036293","response to decreased oxygen levels",7,176,350,1.47238636363636,0.199233145198048,0.92559556367811,"BP"
"GO:0043488","regulation of mRNA stability",3,57,350,1.94842105263158,0.199275540815811,0.92559556367811,"BP"
"GO:0071695","anatomical structure maturation",3,57,350,1.94842105263158,0.199275540815811,0.92559556367811,"BP"
"GO:0019843","rRNA binding",3,57,350,1.94842105263158,0.199275540815811,0.92559556367811,"MF"
"GO:0051287","NAD binding",3,57,350,1.94842105263158,0.199275540815811,0.92559556367811,"MF"
"GO:0006650","glycerophospholipid metabolic process",7,177,350,1.46406779661017,0.203023501396462,0.939733465362608,"BP"
"GO:0006110","regulation of glycolytic process",2,31,350,2.38838709677419,0.203781359410848,0.939733465362608,"BP"
"GO:0006195","purine nucleotide catabolic process",2,31,350,2.38838709677419,0.203781359410848,0.939733465362608,"BP"
"GO:0006775","fat-soluble vitamin metabolic process",2,31,350,2.38838709677419,0.203781359410848,0.939733465362608,"BP"
"GO:0010259","multicellular organism aging",2,31,350,2.38838709677419,0.203781359410848,0.939733465362608,"BP"
"GO:0010718","positive regulation of epithelial to mesenchymal transition",2,31,350,2.38838709677419,0.203781359410848,0.939733465362608,"BP"
"GO:0042181","ketone biosynthetic process",2,31,350,2.38838709677419,0.203781359410848,0.939733465362608,"BP"
"GO:0045581","negative regulation of T cell differentiation",2,31,350,2.38838709677419,0.203781359410848,0.939733465362608,"BP"
"GO:0048048","embryonic eye morphogenesis",2,31,350,2.38838709677419,0.203781359410848,0.939733465362608,"BP"
"GO:0048710","regulation of astrocyte differentiation",2,31,350,2.38838709677419,0.203781359410848,0.939733465362608,"BP"
"GO:0071320","cellular response to cAMP",2,31,350,2.38838709677419,0.203781359410848,0.939733465362608,"BP"
"GO:2000779","regulation of double-strand break repair",2,31,350,2.38838709677419,0.203781359410848,0.939733465362608,"BP"
"GO:2001222","regulation of neuron migration",2,31,350,2.38838709677419,0.203781359410848,0.939733465362608,"BP"
"GO:0048844","artery morphogenesis",3,58,350,1.9148275862069,0.206260290651486,0.949592831230752,"BP"
"GO:0098754","detoxification",3,58,350,1.9148275862069,0.206260290651486,0.949592831230752,"BP"
"GO:1900407","regulation of cellular response to oxidative stress",3,58,350,1.9148275862069,0.206260290651486,0.949592831230752,"BP"
"GO:0015837","amine transport",4,87,350,1.70206896551724,0.208571256340276,0.957890156025187,"BP"
"GO:0045667","regulation of osteoblast differentiation",5,117,350,1.58205128205128,0.209627204416601,0.957890156025187,"BP"
"GO:0010506","regulation of autophagy",7,179,350,1.4477094972067,0.210686740535793,0.957890156025187,"BP"
"GO:0016705","oxidoreductase activity, acting on paired donors, with incorporation or reduction of molecular oxygen",7,179,350,1.4477094972067,0.210686740535793,0.957890156025187,"MF"
"GO:0001938","positive regulation of endothelial cell proliferation",3,59,350,1.88237288135593,0.213299886240801,0.957890156025187,"BP"
"GO:0006766","vitamin metabolic process",3,59,350,1.88237288135593,0.213299886240801,0.957890156025187,"BP"
"GO:0061035","regulation of cartilage development",3,59,350,1.88237288135593,0.213299886240801,0.957890156025187,"BP"
"GO:0005518","collagen binding",3,59,350,1.88237288135593,0.213299886240801,0.957890156025187,"MF"
"GO:0003197","endocardial cushion development",2,32,350,2.31375,0.21373785892334,0.957890156025187,"BP"
"GO:0016601","Rac protein signal transduction",2,32,350,2.31375,0.21373785892334,0.957890156025187,"BP"
"GO:0030811","regulation of nucleotide catabolic process",2,32,350,2.31375,0.21373785892334,0.957890156025187,"BP"
"GO:0043489","RNA stabilization",2,32,350,2.31375,0.21373785892334,0.957890156025187,"BP"
"GO:0045987","positive regulation of smooth muscle contraction",2,32,350,2.31375,0.21373785892334,0.957890156025187,"BP"
"GO:0097009","energy homeostasis",2,32,350,2.31375,0.21373785892334,0.957890156025187,"BP"
"GO:0003705","transcription factor activity, RNA polymerase II distal enhancer sequence-specific binding",4,88,350,1.68272727272727,0.214237895559291,0.957890156025187,"MF"
"GO:0090257","regulation of muscle system process",7,181,350,1.43171270718232,0.218456225507057,0.957890156025187,"BP"
"GO:0000050","urea cycle",1,9,350,4.11333333333333,0.218494331903304,0.957890156025187,"BP"
"GO:0001865","NK T cell differentiation",1,9,350,4.11333333333333,0.218494331903304,0.957890156025187,"BP"
"GO:0002176","male germ cell proliferation",1,9,350,4.11333333333333,0.218494331903304,0.957890156025187,"BP"
"GO:0002420","natural killer cell mediated cytotoxicity directed against tumor cell target",1,9,350,4.11333333333333,0.218494331903304,0.957890156025187,"BP"
"GO:0002423","natural killer cell mediated immune response to tumor cell",1,9,350,4.11333333333333,0.218494331903304,0.957890156025187,"BP"
"GO:0002477","antigen processing and presentation of exogenous peptide antigen via MHC class Ib",1,9,350,4.11333333333333,0.218494331903304,0.957890156025187,"BP"
"GO:0002481","antigen processing and presentation of exogenous protein antigen via MHC class Ib, TAP-dependent",1,9,350,4.11333333333333,0.218494331903304,0.957890156025187,"BP"
"GO:0002484","antigen processing and presentation of endogenous peptide antigen via MHC class I via ER pathway",1,9,350,4.11333333333333,0.218494331903304,0.957890156025187,"BP"
"GO:0002485","antigen processing and presentation of endogenous peptide antigen via MHC class I via ER pathway, TAP-dependent",1,9,350,4.11333333333333,0.218494331903304,0.957890156025187,"BP"
"GO:0002589","regulation of antigen processing and presentation of peptide antigen via MHC class I",1,9,350,4.11333333333333,0.218494331903304,0.957890156025187,"BP"
"GO:0002855","regulation of natural killer cell mediated immune response to tumor cell",1,9,350,4.11333333333333,0.218494331903304,0.957890156025187,"BP"
"GO:0002858","regulation of natural killer cell mediated cytotoxicity directed against tumor cell target",1,9,350,4.11333333333333,0.218494331903304,0.957890156025187,"BP"
"GO:0006002","fructose 6-phosphate metabolic process",1,9,350,4.11333333333333,0.218494331903304,0.957890156025187,"BP"
"GO:0006273","lagging strand elongation",1,9,350,4.11333333333333,0.218494331903304,0.957890156025187,"BP"
"GO:0006977","DNA damage response, signal transduction by p53 class mediator resulting in cell cycle arrest",1,9,350,4.11333333333333,0.218494331903304,0.957890156025187,"BP"
"GO:0009162","deoxyribonucleoside monophosphate metabolic process",1,9,350,4.11333333333333,0.218494331903304,0.957890156025187,"BP"
"GO:0009219","pyrimidine deoxyribonucleotide metabolic process",1,9,350,4.11333333333333,0.218494331903304,0.957890156025187,"BP"
"GO:0009265","2'-deoxyribonucleotide biosynthetic process",1,9,350,4.11333333333333,0.218494331903304,0.957890156025187,"BP"
"GO:0010692","regulation of alkaline phosphatase activity",1,9,350,4.11333333333333,0.218494331903304,0.957890156025187,"BP"
"GO:0014050","negative regulation of glutamate secretion",1,9,350,4.11333333333333,0.218494331903304,0.957890156025187,"BP"
"GO:0014062","regulation of serotonin secretion",1,9,350,4.11333333333333,0.218494331903304,0.957890156025187,"BP"
"GO:0014831","gastro-intestinal system smooth muscle contraction",1,9,350,4.11333333333333,0.218494331903304,0.957890156025187,"BP"
"GO:0016338","calcium-independent cell-cell adhesion via plasma membrane cell-adhesion molecules",1,9,350,4.11333333333333,0.218494331903304,0.957890156025187,"BP"
"GO:0017121","phospholipid scrambling",1,9,350,4.11333333333333,0.218494331903304,0.957890156025187,"BP"
"GO:0019321","pentose metabolic process",1,9,350,4.11333333333333,0.218494331903304,0.957890156025187,"BP"
"GO:0021612","facial nerve structural organization",1,9,350,4.11333333333333,0.218494331903304,0.957890156025187,"BP"
"GO:0021873","forebrain neuroblast division",1,9,350,4.11333333333333,0.218494331903304,0.957890156025187,"BP"
"GO:0030644","cellular chloride ion homeostasis",1,9,350,4.11333333333333,0.218494331903304,0.957890156025187,"BP"
"GO:0031943","regulation of glucocorticoid metabolic process",1,9,350,4.11333333333333,0.218494331903304,0.957890156025187,"BP"
"GO:0032351","negative regulation of hormone metabolic process",1,9,350,4.11333333333333,0.218494331903304,0.957890156025187,"BP"
"GO:0032367","intracellular cholesterol transport",1,9,350,4.11333333333333,0.218494331903304,0.957890156025187,"BP"
"GO:0032754","positive regulation of interleukin-5 production",1,9,350,4.11333333333333,0.218494331903304,0.957890156025187,"BP"
"GO:0033085","negative regulation of T cell differentiation in thymus",1,9,350,4.11333333333333,0.218494331903304,0.957890156025187,"BP"
"GO:0034350","regulation of glial cell apoptotic process",1,9,350,4.11333333333333,0.218494331903304,0.957890156025187,"BP"
"GO:0042090","interleukin-12 biosynthetic process",1,9,350,4.11333333333333,0.218494331903304,0.957890156025187,"BP"
"GO:0043569","negative regulation of insulin-like growth factor receptor signaling pathway",1,9,350,4.11333333333333,0.218494331903304,0.957890156025187,"BP"
"GO:0045075","regulation of interleukin-12 biosynthetic process",1,9,350,4.11333333333333,0.218494331903304,0.957890156025187,"BP"
"GO:0045350","interferon-beta biosynthetic process",1,9,350,4.11333333333333,0.218494331903304,0.957890156025187,"BP"
"GO:0045357","regulation of interferon-beta biosynthetic process",1,9,350,4.11333333333333,0.218494331903304,0.957890156025187,"BP"
"GO:0045625","regulation of T-helper 1 cell differentiation",1,9,350,4.11333333333333,0.218494331903304,0.957890156025187,"BP"
"GO:0046085","adenosine metabolic process",1,9,350,4.11333333333333,0.218494331903304,0.957890156025187,"BP"
"GO:0046385","deoxyribose phosphate biosynthetic process",1,9,350,4.11333333333333,0.218494331903304,0.957890156025187,"BP"
"GO:0046386","deoxyribose phosphate catabolic process",1,9,350,4.11333333333333,0.218494331903304,0.957890156025187,"BP"
"GO:0048733","sebaceous gland development",1,9,350,4.11333333333333,0.218494331903304,0.957890156025187,"BP"
"GO:0051823","regulation of synapse structural plasticity",1,9,350,4.11333333333333,0.218494331903304,0.957890156025187,"BP"
"GO:0060028","convergent extension involved in axis elongation",1,9,350,4.11333333333333,0.218494331903304,0.957890156025187,"BP"
"GO:0060592","mammary gland formation",1,9,350,4.11333333333333,0.218494331903304,0.957890156025187,"BP"
"GO:0061314","Notch signaling involved in heart development",1,9,350,4.11333333333333,0.218494331903304,0.957890156025187,"BP"
"GO:0070493","thrombin receptor signaling pathway",1,9,350,4.11333333333333,0.218494331903304,0.957890156025187,"BP"
"GO:0071243","cellular response to arsenic-containing substance",1,9,350,4.11333333333333,0.218494331903304,0.957890156025187,"BP"
"GO:0071888","macrophage apoptotic process",1,9,350,4.11333333333333,0.218494331903304,0.957890156025187,"BP"
"GO:0072102","glomerulus morphogenesis",1,9,350,4.11333333333333,0.218494331903304,0.957890156025187,"BP"
"GO:0072110","glomerular mesangial cell proliferation",1,9,350,4.11333333333333,0.218494331903304,0.957890156025187,"BP"
"GO:0097421","liver regeneration",1,9,350,4.11333333333333,0.218494331903304,0.957890156025187,"BP"
"GO:1900225","regulation of NLRP3 inflammasome complex assembly",1,9,350,4.11333333333333,0.218494331903304,0.957890156025187,"BP"
"GO:1900424","regulation of defense response to bacterium",1,9,350,4.11333333333333,0.218494331903304,0.957890156025187,"BP"
"GO:1902033","regulation of hematopoietic stem cell proliferation",1,9,350,4.11333333333333,0.218494331903304,0.957890156025187,"BP"
"GO:1902510","regulation of apoptotic DNA fragmentation",1,9,350,4.11333333333333,0.218494331903304,0.957890156025187,"BP"
"GO:1902895","positive regulation of pri-miRNA transcription from RNA polymerase II promoter",1,9,350,4.11333333333333,0.218494331903304,0.957890156025187,"BP"
"GO:1903975","regulation of glial cell migration",1,9,350,4.11333333333333,0.218494331903304,0.957890156025187,"BP"
"GO:2000109","regulation of macrophage apoptotic process",1,9,350,4.11333333333333,0.218494331903304,0.957890156025187,"BP"
"GO:2000726","negative regulation of cardiac muscle cell differentiation",1,9,350,4.11333333333333,0.218494331903304,0.957890156025187,"BP"
"GO:2001275","positive regulation of glucose import in response to insulin stimulus",1,9,350,4.11333333333333,0.218494331903304,0.957890156025187,"BP"
"GO:0001013","RNA polymerase I regulatory region DNA binding",1,9,350,4.11333333333333,0.218494331903304,0.957890156025187,"MF"
"GO:0004445","inositol-polyphosphate 5-phosphatase activity",1,9,350,4.11333333333333,0.218494331903304,0.957890156025187,"MF"
"GO:0004935","adrenergic receptor activity",1,9,350,4.11333333333333,0.218494331903304,0.957890156025187,"MF"
"GO:0004955","prostaglandin receptor activity",1,9,350,4.11333333333333,0.218494331903304,0.957890156025187,"MF"
"GO:0005451","monovalent cation:proton antiporter activity",1,9,350,4.11333333333333,0.218494331903304,0.957890156025187,"MF"
"GO:0015174","basic amino acid transmembrane transporter activity",1,9,350,4.11333333333333,0.218494331903304,0.957890156025187,"MF"
"GO:0019534","toxin transporter activity",1,9,350,4.11333333333333,0.218494331903304,0.957890156025187,"MF"
"GO:0031432","titin binding",1,9,350,4.11333333333333,0.218494331903304,0.957890156025187,"MF"
"GO:0039706","co-receptor binding",1,9,350,4.11333333333333,0.218494331903304,0.957890156025187,"MF"
"GO:0070513","death domain binding",1,9,350,4.11333333333333,0.218494331903304,0.957890156025187,"MF"
"GO:0070568","guanylyltransferase activity",1,9,350,4.11333333333333,0.218494331903304,0.957890156025187,"MF"
"GO:0097153","cysteine-type endopeptidase activity involved in apoptotic process",1,9,350,4.11333333333333,0.218494331903304,0.957890156025187,"MF"
"GO:0001936","regulation of endothelial cell proliferation",4,89,350,1.6638202247191,0.219946801519987,0.962742521477743,"BP"
"GO:0030817","regulation of cAMP biosynthetic process",4,89,350,1.6638202247191,0.219946801519987,0.962742521477743,"BP"
"GO:0004520","endodeoxyribonuclease activity",4,89,350,1.6638202247191,0.219946801519987,0.962742521477743,"MF"
"GO:0030301","cholesterol transport",3,60,350,1.851,0.22039045092817,0.964179375893083,"BP"
"GO:0048839","inner ear development",7,182,350,1.42384615384615,0.222379367030954,0.972371528472345,"BP"
"GO:0009395","phospholipid catabolic process",2,33,350,2.24363636363636,0.22373881386137,0.976272338707889,"BP"
"GO:0030431","sleep",2,33,350,2.24363636363636,0.22373881386137,0.976272338707889,"BP"
"GO:0051281","positive regulation of release of sequestered calcium ion into cytosol",2,33,350,2.24363636363636,0.22373881386137,0.976272338707889,"BP"
"GO:0008933","lytic transglycosylase activity",2,33,350,2.24363636363636,0.22373881386137,0.976272338707889,"MF"
"GO:1901216","positive regulation of neuron death",4,90,350,1.64533333333333,0.225695997216491,0.984298409572546,"BP"
"GO:0002312","B cell activation involved in immune response",3,61,350,1.82065573770492,0.227528164335978,0.990221531870537,"BP"
"GO:0015918","sterol transport",3,61,350,1.82065573770492,0.227528164335978,0.990221531870537,"BP"
"GO:0055024","regulation of cardiac muscle tissue development",3,61,350,1.82065573770492,0.227528164335978,0.990221531870537,"BP"
"GO:0003727","single-stranded RNA binding",3,61,350,1.82065573770492,0.227528164335978,0.990221531870537,"MF"
"GO:0043281","regulation of cysteine-type endopeptidase activity involved in apoptotic process",7,184,350,1.40836956521739,0.230299515167125,0.994664406173117,"BP"
"GO:0030216","keratinocyte differentiation",4,91,350,1.62725274725275,0.231483511331663,0.994664406173117,"BP"
"GO:0050886","endocrine process",4,91,350,1.62725274725275,0.231483511331663,0.994664406173117,"BP"
"GO:0003401","axis elongation",2,34,350,2.17764705882353,0.233774591065898,0.994664406173117,"BP"
"GO:0007140","male meiosis",2,34,350,2.17764705882353,0.233774591065898,0.994664406173117,"BP"
"GO:0019674","NAD metabolic process",2,34,350,2.17764705882353,0.233774591065898,0.994664406173117,"BP"
"GO:0046503","glycerolipid catabolic process",2,34,350,2.17764705882353,0.233774591065898,0.994664406173117,"BP"
"GO:0060325","face morphogenesis",2,34,350,2.17764705882353,0.233774591065898,0.994664406173117,"BP"
"GO:0097300","programmed necrotic cell death",2,34,350,2.17764705882353,0.233774591065898,0.994664406173117,"BP"
"GO:0070851","growth factor receptor binding",5,122,350,1.5172131147541,0.234173192329225,0.994664406173117,"MF"
"GO:0014015","positive regulation of gliogenesis",3,62,350,1.79129032258065,0.23470926516192,0.994664406173117,"BP"
"GO:0032414","positive regulation of ion transmembrane transporter activity",3,62,350,1.79129032258065,0.23470926516192,0.994664406173117,"BP"
"GO:0051785","positive regulation of nuclear division",3,62,350,1.79129032258065,0.23470926516192,0.994664406173117,"BP"
